{
  "$schema": "https://json-schema.org/draft/2020-12/schema",
  "title": "GitHub Project Manager Configuration",
  "description": "Configuration schema for the GitHub Project Manager script",
  "type": "object",
  "required": ["repository"],
  "properties": {
    "repository": {
      "type": "object",
      "required": ["owner", "name"],
      "properties": {
        "owner": {
          "type": "string",
          "description": "GitHub repository owner (username or organization)"
        },
        "name": {
          "type": "string",
          "description": "GitHub repository name"
        },
        "description": {
          "type": "string",
          "description": "Repository description for documentation"
        }
      }
    },
    "labels": {
      "type": "array",
      "description": "GitHub labels to create or update",
      "items": {
        "type": "object",
        "required": ["name", "color"],
        "properties": {
          "name": {
            "type": "string",
            "description": "Label name"
          },
          "color": {
            "type": "string",
            "pattern": "^[0-9A-Fa-f]{6}$",
            "description": "Label color (6-digit hex code without #)"
          },
          "description": {
            "type": "string",
            "description": "Label description"
          }
        }
      }
    },
    "milestones": {
      "type": "array",
      "description": "GitHub milestones to create",
      "items": {
        "type": "object",
        "required": ["title"],
        "properties": {
          "title": {
            "type": "string",
            "description": "Milestone title"
          },
          "description": {
            "type": "string",
            "description": "Milestone description"
          },
          "due_date": {
            "type": "string",
            "format": "date-time",
            "description": "Milestone due date (ISO 8601 format)"
          }
        }
      }
    },
    "projects": {
      "type": "array",
      "description": "GitHub projects to create",
      "items": {
        "type": "object",
        "required": ["title"],
        "properties": {
          "title": {
            "type": "string",
            "description": "Project title"
          },
          "body": {
            "type": "string",
            "description": "Project description/body"
          },
          "issue_patterns": {
            "type": "array",
            "description": "Patterns to match issue titles for adding to this project",
            "items": {
              "type": "string"
            }
          }
        }
      }
    },
    "issues": {
      "type": "array",
      "description": "GitHub issues to create",
      "items": {
        "type": "object",
        "required": ["title"],
        "properties": {
          "title": {
            "type": "string",
            "description": "Issue title"
          },
          "body": {
            "type": "string",
            "description": "Issue body/description (supports Markdown)"
          },
          "labels": {
            "type": "array",
            "description": "Labels to apply to the issue",
            "items": {
              "type": "string"
            }
          },
          "assignees": {
            "type": "array",
            "description": "GitHub usernames to assign to the issue",
            "items": {
              "type": "string"
            }
          },
          "milestone": {
            "type": "string",
            "description": "Milestone title to assign to the issue"
          }
        }
      }
    }
  }
}
