{
  "repository": {
    "owner": "jdfalk",
    "name": "gcommon",
    "description": "Common protobuf definitions and gRPC services for microservices architecture"
  },
  "labels": [
    {
      "name": "module:auth",
      "color": "FF6B6B",
      "description": "Authentication and authorization module"
    },
    {
      "name": "module:billing",
      "color": "4ECDC4",
      "description": "Billing and payment processing module"
    },
    {
      "name": "module:core",
      "color": "45B7D1",
      "description": "Core foundational module"
    },
    {
      "name": "module:iam",
      "color": "96CEB4",
      "description": "Identity and Access Management module"
    },
    {
      "name": "module:ledger",
      "color": "FFEAA7",
      "description": "Financial ledger and accounting module"
    },
    {
      "name": "module:notification",
      "color": "DDA0DD",
      "description": "Notification and messaging module"
    },
    {
      "name": "module:organization",
      "color": "98D8C8",
      "description": "Organization and tenant management module"
    },
    {
      "name": "module:payment",
      "color": "F7DC6F",
      "description": "Payment processing and gateway module"
    },
    {
      "name": "module:wallet",
      "color": "BB8FCE",
      "description": "Digital wallet and balance management module"
    },
    {
      "name": "type:protobuf",
      "color": "0052CC",
      "description": "Protocol buffer definitions and schemas"
    },
    {
      "name": "type:grpc",
      "color": "006B75",
      "description": "gRPC service definitions and implementations"
    },
    {
      "name": "type:provider",
      "color": "0E4B8C",
      "description": "Service provider implementations"
    },
    {
      "name": "type:testing",
      "color": "5E4037",
      "description": "Testing infrastructure and test cases"
    },
    {
      "name": "type:documentation",
      "color": "1B5E20",
      "description": "Documentation and guides"
    },
    {
      "name": "type:infrastructure",
      "color": "37474F",
      "description": "Infrastructure and deployment configurations"
    },
    {
      "name": "priority:high",
      "color": "D73A49",
      "description": "High priority issues requiring immediate attention"
    },
    {
      "name": "priority:medium",
      "color": "FB8C00",
      "description": "Medium priority issues for next iteration"
    },
    {
      "name": "priority:low",
      "color": "28A745",
      "description": "Low priority issues for future consideration"
    },
    {
      "name": "size:small",
      "color": "C5DEF5",
      "description": "Small task (1-2 days)"
    },
    {
      "name": "size:medium",
      "color": "7FB3D5",
      "description": "Medium task (3-5 days)"
    },
    {
      "name": "size:large",
      "color": "5499C7",
      "description": "Large task (1-2 weeks)"
    },
    {
      "name": "size:epic",
      "color": "2E86C1",
      "description": "Epic task (multiple weeks)"
    },
    {
      "name": "status:blocked",
      "color": "E74C3C",
      "description": "Task is blocked by external dependencies"
    },
    {
      "name": "status:in-progress",
      "color": "F39C12",
      "description": "Task is currently being worked on"
    },
    {
      "name": "status:review",
      "color": "9B59B6",
      "description": "Task is ready for review"
    },
    {
      "name": "good first issue",
      "color": "7057FF",
      "description": "Good for newcomers to the project"
    },
    {
      "name": "help wanted",
      "color": "008672",
      "description": "Extra attention is needed from the community"
    },
    {
      "name": "enhancement",
      "color": "A2EEEF",
      "description": "New feature or request"
    },
    {
      "name": "bug",
      "color": "D73A49",
      "description": "Something isn't working"
    },
    {
      "name": "question",
      "color": "D876E3",
      "description": "Further information is requested"
    }
  ],
  "milestones": [
    {
      "title": "v0.2.0 - Core Foundation",
      "description": "Complete core protobuf definitions and basic gRPC service interfaces for all modules",
      "due_date": "2025-03-01T00:00:00Z"
    },
    {
      "title": "v0.5.0 - Service Implementation",
      "description": "Implement gRPC service providers and comprehensive testing framework",
      "due_date": "2025-06-01T00:00:00Z"
    },
    {
      "title": "v0.8.0 - Integration Ready",
      "description": "Complete integration testing, documentation, and deployment configurations",
      "due_date": "2025-09-01T00:00:00Z"
    },
    {
      "title": "v1.0.0 - Production Release",
      "description": "First stable release with complete feature set and production-ready infrastructure",
      "due_date": "2026-01-01T00:00:00Z"
    }
  ],
  "projects": [
    {
      "title": "gCommon Development",
      "body": "Comprehensive development tracking for gCommon protobuf definitions and gRPC services across all modules",
      "issue_patterns": [
        "Auth Module",
        "Billing Module",
        "Core Module",
        "IAM Module",
        "Ledger Module",
        "Notification Module",
        "Organization Module",
        "Payment Module",
        "Wallet Module"
      ]
    }
  ],
  "issues": [
    {
      "title": "Auth Module: Complete Protobuf Definitions",
      "body": "## Overview\nImplement comprehensive protobuf definitions for the authentication and authorization module.\n\n## Tasks\n- [ ] Define user authentication message types\n- [ ] Define session management structures\n- [ ] Define JWT token handling\n- [ ] Define OAuth2 flow messages\n- [ ] Define role-based access control (RBAC) structures\n- [ ] Define multi-factor authentication (MFA) messages\n- [ ] Add comprehensive field documentation\n- [ ] Validate proto compilation\n\n## Acceptance Criteria\n- All auth proto files compile successfully\n- Message types support common authentication flows\n- Proper field validation and constraints\n- Complete inline documentation\n\n## Files to Update\n- `proto/gcommon/v1/auth/*.proto`\n\n## Related\n- Depends on core module foundation\n- Integrates with IAM module",
      "labels": ["module:auth", "type:protobuf", "priority:high", "size:large"],
      "milestone": "v0.2.0 - Core Foundation"
    },
    {
      "title": "Auth Module: Implement gRPC Service Definitions",
      "body": "## Overview\nDefine gRPC service interfaces for authentication and authorization operations.\n\n## Tasks\n- [ ] Define AuthenticationService interface\n- [ ] Define AuthorizationService interface\n- [ ] Define SessionService interface\n- [ ] Define TokenService interface\n- [ ] Add comprehensive method documentation\n- [ ] Define error handling patterns\n- [ ] Add service-level metadata\n\n## Acceptance Criteria\n- All gRPC services compile successfully\n- Methods support standard auth operations\n- Proper error code definitions\n- Complete service documentation\n\n## Files to Update\n- `proto/gcommon/v1/auth/services/*.proto`",
      "labels": ["module:auth", "type:grpc", "priority:high", "size:medium"],
      "milestone": "v0.2.0 - Core Foundation"
    },
    {
      "title": "Auth Module: Create Service Provider Implementation",
      "body": "## Overview\nImplement Go service providers for authentication and authorization services.\n\n## Tasks\n- [ ] Create AuthenticationProvider interface\n- [ ] Create AuthorizationProvider interface  \n- [ ] Create SessionProvider interface\n- [ ] Create TokenProvider interface\n- [ ] Implement mock providers for testing\n- [ ] Add provider registration system\n- [ ] Add comprehensive error handling\n\n## Acceptance Criteria\n- All providers implement defined interfaces\n- Mock providers support testing scenarios\n- Proper dependency injection support\n- Complete provider documentation\n\n## Files to Create\n- `providers/auth/*.go`",
      "labels": ["module:auth", "type:provider", "priority:medium", "size:large"],
      "milestone": "v0.5.0 - Service Implementation"
    },
    {
      "title": "Auth Module: Develop Testing Framework",
      "body": "## Overview\nCreate comprehensive testing framework for auth module components.\n\n## Tasks\n- [ ] Create unit tests for proto validation\n- [ ] Create integration tests for gRPC services\n- [ ] Create provider implementation tests\n- [ ] Add test data fixtures\n- [ ] Add benchmark tests\n- [ ] Add security testing scenarios\n- [ ] Set up continuous testing pipeline\n\n## Acceptance Criteria\n- 90%+ test coverage for all components\n- All tests pass consistently\n- Performance benchmarks established\n- Security tests validate auth flows\n\n## Files to Create\n- `tests/auth/*.go`",
      "labels": ["module:auth", "type:testing", "priority:medium", "size:medium"],
      "milestone": "v0.5.0 - Service Implementation"
    },
    {
      "title": "Billing Module: Complete Protobuf Definitions",
      "body": "## Overview\nImplement comprehensive protobuf definitions for billing and subscription management.\n\n## Tasks\n- [ ] Define subscription management message types\n- [ ] Define billing cycle structures\n- [ ] Define invoice generation messages\n- [ ] Define payment plan structures\n- [ ] Define usage tracking messages\n- [ ] Define billing event notifications\n- [ ] Add comprehensive field documentation\n- [ ] Validate proto compilation\n\n## Acceptance Criteria\n- All billing proto files compile successfully\n- Message types support subscription billing flows\n- Proper field validation and constraints\n- Complete inline documentation\n\n## Files to Update\n- `proto/gcommon/v1/billing/*.proto`",
      "labels": ["module:billing", "type:protobuf", "priority:high", "size:large"],
      "milestone": "v0.2.0 - Core Foundation"
    },
    {
      "title": "Billing Module: Implement gRPC Service Definitions",